{
  "schemaVersion": 1,
  "type": "playerAnimation",
  "id": "core:player-animation/reload-pump-action",
  "rig": "core:player-rig/alex",
  "displayName": "ReloadPumpAction",
  "durationSeconds": 0.6666667,
  "frameRate": 60.0,
  "loop": false,
  "tracks": [
    {
      "target": "bone/arm-right-upper",
      "property": "rotation.x",
      "keys": [
        {
          "time": 0.0,
          "value": 0.0,
          "inTangent": 0.0,
          "outTangent": 0.0
        },
        {
          "time": 0.6666667,
          "value": 0.0,
          "inTangent": 0.0,
          "outTangent": 0.0
        }
      ]
    },
    {
      "target": "bone/arm-right-upper",
      "property": "rotation.y",
      "keys": [
        {
          "time": 0.0,
          "value": 0.0,
          "inTangent": 0.0,
          "outTangent": 0.0
        },
        {
          "time": 0.6666667,
          "value": 0.0,
          "inTangent": 0.0,
          "outTangent": 0.0
        }
      ]
    },
    {
      "target": "bone/arm-right-upper",
      "property": "rotation.z",
      "keys": [
        {
          "time": 0.0,
          "value": 0.0,
          "inTangent": 0.0,
          "outTangent": 0.0
        },
        {
          "time": 0.6666667,
          "value": 4.453,
          "inTangent": -1.19438755E-06,
          "outTangent": 0.0
        }
      ]
    },
    {
      "target": "bone/arm-right-lower",
      "property": "rotation.x",
      "keys": [
        {
          "time": 0.0,
          "value": 0.0,
          "inTangent": 0.0,
          "outTangent": 0.0
        },
        {
          "time": 0.6666667,
          "value": 0.0,
          "inTangent": 0.0,
          "outTangent": 0.0
        }
      ]
    },
    {
      "target": "bone/arm-right-lower",
      "property": "rotation.y",
      "keys": [
        {
          "time": 0.0,
          "value": 0.0,
          "inTangent": 0.0,
          "outTangent": 0.0
        },
        {
          "time": 0.6666667,
          "value": 0.0,
          "inTangent": 0.0,
          "outTangent": 0.0
        }
      ]
    },
    {
      "target": "bone/arm-right-lower",
      "property": "rotation.z",
      "keys": [
        {
          "time": 0.0,
          "value": 0.0,
          "inTangent": 0.0,
          "outTangent": 0.0
        },
        {
          "time": 0.6666667,
          "value": 117.513008,
          "inTangent": -3.151944E-05,
          "outTangent": 0.0
        }
      ]
    },
    {
      "target": "bone/arm-left-upper",
      "property": "rotation.x",
      "keys": [
        {
          "time": 0.0,
          "value": 0.0,
          "inTangent": 0.0,
          "outTangent": 0.0
        },
        {
          "time": 0.6666667,
          "value": 0.0,
          "inTangent": 0.0,
          "outTangent": 0.0
        }
      ]
    },
    {
      "target": "bone/arm-left-upper",
      "property": "rotation.y",
      "keys": [
        {
          "time": 0.0,
          "value": 0.0,
          "inTangent": 0.0,
          "outTangent": 0.0
        },
        {
          "time": 0.6666667,
          "value": 0.0,
          "inTangent": 0.0,
          "outTangent": 0.0
        }
      ]
    },
    {
      "target": "bone/arm-left-upper",
      "property": "rotation.z",
      "keys": [
        {
          "time": 0.0,
          "value": 0.0,
          "inTangent": 0.0,
          "outTangent": 0.0
        },
        {
          "time": 0.6666667,
          "value": -38.04,
          "inTangent": 1.02031227E-05,
          "outTangent": 0.0
        }
      ]
    },
    {
      "target": "bone/arm-left-lower",
      "property": "rotation.x",
      "keys": [
        {
          "time": 0.0,
          "value": 0.0,
          "inTangent": 0.0,
          "outTangent": 0.0
        },
        {
          "time": 0.6666667,
          "value": 0.0,
          "inTangent": 0.0,
          "outTangent": 0.0
        }
      ]
    },
    {
      "target": "bone/arm-left-lower",
      "property": "rotation.y",
      "keys": [
        {
          "time": 0.0,
          "value": 0.0,
          "inTangent": 0.0,
          "outTangent": 0.0
        },
        {
          "time": 0.6666667,
          "value": 0.0,
          "inTangent": 0.0,
          "outTangent": 0.0
        }
      ]
    },
    {
      "target": "bone/arm-left-lower",
      "property": "rotation.z",
      "keys": [
        {
          "time": 0.0,
          "value": 0.0,
          "inTangent": 0.0,
          "outTangent": 0.0
        },
        {
          "time": 0.6666667,
          "value": 78.819,
          "inTangent": 6.0239312E-05,
          "outTangent": 0.0
        }
      ]
    },
    {
      "target": "bone/hand-left",
      "property": "rotation.x",
      "keys": [
        {
          "time": 0.0,
          "value": 0.0,
          "inTangent": 0.0,
          "outTangent": 0.0
        },
        {
          "time": 0.6666667,
          "value": 0.0,
          "inTangent": 0.0,
          "outTangent": 0.0
        }
      ]
    },
    {
      "target": "bone/hand-left",
      "property": "rotation.y",
      "keys": [
        {
          "time": 0.0,
          "value": 0.0,
          "inTangent": 0.0,
          "outTangent": 0.0
        },
        {
          "time": 0.6666667,
          "value": 0.0,
          "inTangent": 0.0,
          "outTangent": 0.0
        }
      ]
    },
    {
      "target": "bone/hand-left",
      "property": "rotation.z",
      "keys": [
        {
          "time": 0.0,
          "value": 0.0,
          "inTangent": 0.0,
          "outTangent": 0.0
        },
        {
          "time": 0.6666667,
          "value": 8.502001,
          "inTangent": 2.80584914E-06,
          "outTangent": 0.0
        }
      ]
    },
    {
      "target": "bone/neck",
      "property": "rotation.x",
      "keys": [
        {
          "time": 0.0,
          "value": 0.0,
          "inTangent": 0.0,
          "outTangent": 0.0
        },
        {
          "time": 0.6666667,
          "value": 0.0,
          "inTangent": 0.0,
          "outTangent": 0.0
        }
      ]
    },
    {
      "target": "bone/neck",
      "property": "rotation.y",
      "keys": [
        {
          "time": 0.0,
          "value": 0.0,
          "inTangent": 0.0,
          "outTangent": 0.0
        },
        {
          "time": 0.6666667,
          "value": 0.0,
          "inTangent": 0.0,
          "outTangent": 0.0
        }
      ]
    },
    {
      "target": "bone/neck",
      "property": "rotation.z",
      "keys": [
        {
          "time": 0.0,
          "value": 0.0,
          "inTangent": 0.0,
          "outTangent": 0.0
        },
        {
          "time": 0.6666667,
          "value": -14.2120008,
          "inTangent": 3.81195514E-06,
          "outTangent": 0.0
        }
      ]
    }
  ],
  "objectTracks": [],
  "events": [],
  "effects": [],
  "effectTriggers": [],
  "warnings": [],
  "source": {
    "unityClip": "Assets/AnimationClip/ReloadPumpAction.anim"
  }
}